[
  {
    "id": "port-dns",
    "service": "DNS (Domain Name System)",
    "port": "53",
    "transport": "TCP/UDP",
    "description": "Translates human-readable domain names into IP addresses. Uses UDP for standard queries under 512 bytes (or EDNS0) and TCP for zone transfers (AXFR/IXFR) or large query responses.",
    "category": "Core Infrastructure",
    "securityNotes": "DNS traffic is plaintext by default. Deploy DNSSEC to prevent cache poisoning, and adopt DoT (DNS over TLS, port 853) or DoH (port 443) for transport privacy.",
    "keywords": ["dns", "name resolution", "53", "udp", "tcp", "bind", "edns", "axfr", "root hints"]
  },
  {
    "id": "port-dhcp",
    "service": "DHCP (Dynamic Host Configuration Protocol)",
    "port": "67/68",
    "transport": "UDP",
    "description": "Automatically assigns IPv4 addresses, subnet masks, default gateways, and DNS servers to network clients. Port 67 serves DHCP server listening; Port 68 serves client responses (DORA exchange).",
    "category": "Core Infrastructure",
    "securityNotes": "Vulnerable to rogue DHCP servers and DHCP starvation attacks. Mitigate on enterprise switches with DHCP Snooping, Option 82 insertion, and Dynamic ARP Inspection (DAI).",
    "keywords": ["dhcp", "dora", "67", "68", "ip address assignment", "lease", "options", "snooping"]
  },
  {
    "id": "port-ntp",
    "service": "NTP (Network Time Protocol)",
    "port": "123",
    "transport": "UDP",
    "description": "Synchronizes computer clocks across packet-switched data networks to millisecond precision using a hierarchical stratum architecture (Stratum 0 atomic reference down to Stratum 1-15 servers).",
    "category": "Core Infrastructure",
    "securityNotes": "Accurate time is essential for Kerberos authentication (5-minute maximum skew tolerance), TLS certificate validity, and forensics log correlation. Restrict access to authoritative internal time sources.",
    "keywords": ["ntp", "time", "clock", "stratum", "123", "chrony", "timesync", "kerberos skew"]
  },
  {
    "id": "port-snmp",
    "service": "SNMP (Simple Network Management Protocol)",
    "port": "161",
    "transport": "UDP",
    "description": "Monitors network devices, servers, routers, and switches for health metrics, interface statistics, and operational telemetry via Management Information Bases (MIBs) and OIDs.",
    "category": "Monitoring & Storage",
    "securityNotes": "SNMPv1 and SNMPv2c transmit community strings in cleartext across the wire. Mandate SNMPv3 which provides user authentication (USM) and cryptographic payload encryption (AES).",
    "keywords": ["snmp", "monitoring", "mib", "oid", "161", "telemetry", "snmpv3", "community string"]
  },
  {
    "id": "port-snmptrap",
    "service": "SNMP Trap",
    "port": "162",
    "transport": "UDP",
    "description": "Asynchronous event notifications sent by managed network devices directly to an SNMP management station or NMS when an unsolicited threshold condition or failure occurs (e.g. link down, power supply failure).",
    "category": "Monitoring & Storage",
    "securityNotes": "Traps can be spoofed on UDP without authentication unless SNMPv3 Inform requests or authenticated trap receivers are configured. Restrict port 162 access via firewall ACLs.",
    "keywords": ["snmp trap", "traps", "162", "asynchronous alerts", "nms", "event monitoring"]
  },
  {
    "id": "port-syslog",
    "service": "Syslog",
    "port": "514",
    "transport": "TCP/UDP",
    "description": "Standard architecture for forwarding system event messages, operational logs, and security telemetry from network devices and Unix/Linux servers to central log collectors (RFC 5424).",
    "category": "Monitoring & Storage",
    "securityNotes": "Standard UDP 514 syslog lacks encryption, sender verification, and delivery guarantees. Adopt Syslog over TLS (RFC 5425, port 6514 TCP) for secure transport to SIEM systems.",
    "keywords": ["syslog", "514", "logging", "rfc 5424", "rsyslog", "syslog-ng", "siem", "events"]
  },
  {
    "id": "port-ssh",
    "service": "SSH (Secure Shell)",
    "port": "22",
    "transport": "TCP",
    "description": "Encrypted remote command-line login, system administration, SFTP file transfer, and secure port forwarding across untrusted networks.",
    "category": "Remote Access & Administration",
    "securityNotes": "Disable direct root SSH login, disable password-based authentication in favor of Ed25519/RSA public keys, enforce rate-limiting or fail2ban, and protect management endpoints behind VPN or bastions.",
    "keywords": ["ssh", "secure shell", "22", "tcp", "terminal", "sftp", "bastion", "public key"]
  },
  {
    "id": "port-rdp",
    "service": "RDP (Remote Desktop Protocol)",
    "port": "3389",
    "transport": "TCP/UDP",
    "description": "Proprietary Microsoft protocol providing interactive graphical desktop access and application virtualization to remote Windows workstations and servers.",
    "category": "Remote Access & Administration",
    "securityNotes": "Never expose port 3389 directly to the public Internet due to continuous ransomware attacks and brute force campaigns. Enforce Network Level Authentication (NLA), MFA, and access via Remote Desktop Gateway.",
    "keywords": ["rdp", "remote desktop", "3389", "mstsc", "nla", "windows terminal services", "vdi"]
  },
  {
    "id": "port-winrm-http",
    "service": "WinRM HTTP (Windows Remote Management)",
    "port": "5985",
    "transport": "TCP",
    "description": "SOAP-based remote management protocol implemented via the WS-Management standard for remote PowerShell execution and automated Windows administration over plaintext HTTP transport.",
    "category": "Remote Access & Administration",
    "securityNotes": "Even though Kerberos encrypts message payloads on domain networks over HTTP, WinRM over HTTPS (port 5986) with valid certificates is recommended on untrusted or non-domain segments.",
    "keywords": ["winrm", "powershell remoting", "ws-management", "5985", "enter-pssession", "invoke-command"]
  },
  {
    "id": "port-winrm-https",
    "service": "WinRM HTTPS",
    "port": "5986",
    "transport": "TCP",
    "description": "Encrypted Windows Remote Management over TLS. Used for secure cross-domain, workgroup, and cloud-to-on-premises PowerShell remoting and automated configuration management (e.g. Ansible).",
    "category": "Remote Access & Administration",
    "securityNotes": "Requires dedicated TLS listener configuration and server certificate binding. Ensures transport-level encryption regardless of whether domain Kerberos authentication is available.",
    "keywords": ["winrm https", "5986", "powershell tls", "ansible windows", "remote management"]
  },
  {
    "id": "port-http",
    "service": "HTTP (Hypertext Transfer Protocol)",
    "port": "80",
    "transport": "TCP",
    "description": "Foundational client-server application protocol for distributing hypertext, web documents, and APIs across the Internet without transport encryption.",
    "category": "Web & Mail Services",
    "securityNotes": "All transmitted data, credentials, and session tokens are unencrypted. In production, configure HTTP solely to issue HTTP 301/308 permanent redirects to HTTPS, and enforce HSTS.",
    "keywords": ["http", "web", "80", "tcp", "cleartext", "hsts", "www", "apache", "nginx"]
  },
  {
    "id": "port-https",
    "service": "HTTPS (HTTP Secure)",
    "port": "443",
    "transport": "TCP",
    "description": "Standard encrypted web protocol encapsulating HTTP within TLS (Transport Layer Security) to ensure bidirectional confidentiality, integrity, and server authentication.",
    "category": "Web & Mail Services",
    "securityNotes": "Mandate modern TLS 1.3 or TLS 1.2 with forward secrecy (ECDHE) ciphers. Disable legacy SSL 3.0, TLS 1.0, and TLS 1.1. Implement automated certificate renewal with ACME.",
    "keywords": ["https", "tls", "ssl", "443", "web encryption", "certificate", "alpn", "http/2", "http/3"]
  },
  {
    "id": "port-smtp",
    "service": "SMTP (Simple Mail Transfer Protocol)",
    "port": "25",
    "transport": "TCP",
    "description": "Standard protocol for message transfer between Mail Transfer Agents (MTAs). Relays electronic mail across the Internet from originating MTA to destination mail server.",
    "category": "Web & Mail Services",
    "securityNotes": "Port 25 is commonly blocked outbound by residential ISPs and cloud providers to prevent spam botnets. Upgrade opportunistic connections to TLS via STARTTLS, and deploy SPF, DKIM, and DMARC.",
    "keywords": ["smtp", "mail relay", "25", "mta", "starttls", "dmarc", "spf", "postfix", "exchange"]
  },
  {
    "id": "port-submission",
    "service": "Message Submission (SMTP Submission)",
    "port": "587",
    "transport": "TCP",
    "description": "Dedicated port for Mail User Agents (MUAs like Outlook, Thunderbird) to submit outgoing mail messages to an authorized outgoing mail server with mandatory client authentication.",
    "category": "Web & Mail Services",
    "securityNotes": "Mandates SMTP authentication (SASL) and STARTTLS encryption before client credentials or mail payloads are accepted, preventing unauthorized relaying.",
    "keywords": ["submission", "smtp auth", "587", "mua", "outgoing mail", "client submission"]
  },
  {
    "id": "port-smtps",
    "service": "SMTPS (SMTP over TLS)",
    "port": "465",
    "transport": "TCP",
    "description": "Implicit TLS mail submission port where the transport session immediately establishes a TLS handshake upon connection before initiating SMTP command sequences.",
    "category": "Web & Mail Services",
    "securityNotes": "Recommended by RFC 8314 for end-user mail submission with immediate cryptographic protection, preventing plaintext fallback vulnerabilities.",
    "keywords": ["smtps", "implicit tls", "465", "mail submission", "rfc 8314"]
  },
  {
    "id": "port-imap",
    "service": "IMAP (Internet Message Access Protocol)",